,Song,Artist,lyrics
19,DENIAL IS A RIVER,Doechii,"Hey, I thought it was all over
What's up, Doechii?
Hey, girl
You know it's been a lil' minute since you and I have had a chat
Has it really?
Probably since, like, your last EP, 'Oh the Places You'll Go'
Oh wow, it's been a minute, yeah (Yeah)
I've been gettin' some calls
Oh?
People are a little bit worried about you
Not worried, okay
And I know that I was kinda that outlet for you, so
You were
Why don't you just tell me what's been goin' on?
Okay

Remember old dude from 2019?
Nice, clean, nigga did me dirtier than laundry (Than laundry)
Took a scroll through his IG
Just to get a DM from his wifey (What the fuck?)
I was so confused, what should Doechii do?
She didn't know about me and I didn't know 'bout Sue
I open up the messages and had to hit the zoom
Turns out the girl was really a dude? (Goddamn)
Nigga think he slicked back 'til I slipped back
Got my lick back, turned a nigga to a knick-knack (To a knick-knack)
I moved on, dropped a couple of songs
And then I went and got signed, now it's 2021

Okay, I just feel like
This is the perfect opportunity for us to just take a second and kind of unpack what's happened to you
You know, this guy cheated on you, and—
Mm, nah (Ow), fuck it

""Platinum record"" this, ""viral record"" that (That)
I'm makin' so much money, I'm all over the net
I'm movin' so fast, no time to process
And no, I'm not in a gang, but I'm always on set (Yeah)
Wrist watch, drip drop, label want the TikToks
Now I'm makin' TikTok music, what thee fuck?
I need a cleanse, need a detox
But we ain't got time to stop, the charts need us (And they do)
Fast forward, me, 2023
I'm stackin' lots of cheese and makin' money
My grass is really green, and—

Honestly, I can't even fucking cap no more, this is a really dark time for me
I'm going through a lot
By ""a lot,"" you mean drugs?
Um, I wouldn't—
Drugs?
No, it's a—
No?
It's a natural plant
No, I'm not judging
I'm not an addict
I'm just saying
I don't think—
You wanna talk about it?
Uh

I mean, fuck, I like pills, I like drugs
I like gettin' money, I like strippers, I like to fuck
I like day-drinkin' and day parties and Hollywood
I like doin' Hollywood shit, snort it? Probably would
What can I say? The shit works, it feels good
And my self-worth's at an all-time low
And just when it couldn't get worse
My ex crashed my place and destroyed all I owned
Whoopsie, made a oopsie
One-hundred thousand dollar ""oops"" made me loopy
I ain't a killer, but don't push me
Don't wanna have to turn a nigga guts into soup beans

Woah! Woah, woah, woah, woah! (Rurr)
Okay, Doechii
We don't wanna revert back into our old ways (Sorry, okay)
So, we're gonna try a breathing exercise, okay? (A'ight, word)
When I breathe, you breathe (Okay, okay)
Alright? Let's go
Uh-uh-uh, uh-uh-ah
Uh, uh, uh, ah
Uh, uh, uh, uh, ah
Uh, uh, uh, uh, ah, woosah"
20,Get it Got it,Adi Oasis,"Aah, ah, ah, ah, aah
Aah, ah, ah, ah, aah

So many times I let it slide
Never made up my mind
Searching but I couldn't find
Something about something new
Cold, frozen, icy blue
But if you heat it up a little bit, ooh

Melt on me, ooh
Melt on me, ooh

I know you came here for something
I don't like making assumptions
But I can tell
This ain't a time to say nothing
Speak on it now while you can
Cause closed lips don't get fed
Aah, ah, ah, ah, aah
Aah, ah, ah, ah, aah

So many days stuck in my ways
Just trynna to get out this maze
I shoulda been riding the waves
Frozen in time, colder than ice
But if you heat it up a little bit...

Melt on mе, ooh
Melt on me, ooh
Melt on mе, ooh
Melt on me, ooh

I know you came here for something
I don't like making assumptions
But I can tell
This ain't a time to say nothing
Speak on it now while you can
Cause closed lips don't get fed

I know you came here for something
I don't like making assumptions
But I can tell
This ain't a time to say nothing
Speak on it now while you can
Cause closed lips don't get fed

(What you came here for)
(What you came here for)
I hope you get it, got it
(What you came here for)
I hope you get it, got it
(What you came here for)
I hope you get it, got it
(What you came here for)
I hope you get it, got it
(What you came here for)
I hope you get it, got it
(What you came here for)
I hope you get it, got it, got it, baby
(What you came here for)
I hope you get it, got it, yeah
(What you came here for)
I hope you get it, got it, got it, got it
(What you came here for)
Got it
Got it
Got it, baby
(What you came here for)
Got it
(What you came here for)"
21,Marigold - Feat. J. Hoard,Adi Oasis,none
22,The Water,Adi Oasis,none
23,Naked - Feat. Leven Kali,Adi Oasis,"You and me now (And me now)
Maybe we should head out to the beach now (Hey)
Got some sand up on your feet now (Feet now)
Tell me 'bout your world and what you dream 'bout (Baby, what you dream 'bout)
'Cause, ooh, that's that look in your eyes (Look in your eyes)
Just how I like (Just how I like)
Sun setting down, let's go inside

Dancing in the moonlight, baby
It's just you and I, ain't no reason to be shy
And that fit you got on, going crazy
But if I'm being honest

I wanna see you naked (I wanna see you naked)
I wanna meet the real you, tell me how you feel, boo
I wanna see you naked (I wanna see you naked)
Maybe we can have a drink, too, bring that champagne through
I wanna see you naked (Ooh, ooh-yeah, yеah-yeah)
Skin to skin until the sunrise all night

Ooh, if you show mе what you hide on the outside (Outside)
I'll make you feel at home, let you inside (Make you feel at home inside)
It's like you see right through me, baby (Hey)
Like you already knew me, baby (Ooh)
(Ah) I don't know where this is going, but it's goin' right, yeah

Dancing in the moonlight, baby
It's just you and I, ain't no reason to be shy
And that fit you got on, going crazy
I'm just being honest

I wanna see you naked (I wanna see you naked)
I wanna meet the real you, tell me how you feel, boo
I wanna see you naked (I wanna see you naked)
If you wanna have a drink, too, bring that champagne through
I wanna see you naked (Ooh, ooh-yeah, yeah-yeah)
Skin to skin until the sunrise, all night
I wanna see you naked (I wanna see you naked)
I wanna meet the real you, tell me how you feel, boo
I wanna see you naked (I wanna see you naked)
Oh, maybe have a drink, too, bring that champagne through, yeah
I wanna see you naked (Ooh, ooh-yeah, yeah-yeah)
Skin to skin until the sunrise, all night

My body, your body all night
Your skin to my skin 'til sunrise
My body, your body all night (All night)
Your skin to my skin 'til sunrise"
24,Adonis - Feat. KIRBY,Adi Oasis,"Hey
When I walk in the room you know they like to turn around and say, ""Miss Adi""
""Hey""
When I walk in the room and they see that ass they say, ""Mm, now say it in french, girl""
Talk to me

I don't want to question your decisions, babe
I don't mean to be in your business
All these conversations in your mind, that you're having
If you're asking for my opinion
What you got is so fly
Why you wasting all your time?
You know what to say to feel right
Lot of lows for just a few highs

Woke up in the morning feeling like a bad bitch
 feeling damaged
I can see you settle for the average
Tell 'em pack his bags and the bullshit, girl

Toxic love is just bad habit (tell him)
Waking up ain't lonely for a (bad bitch)
Toxic love is just bad habit (tell him)
If it ain't workin', don't work it, baby
I've been back and forth in my feelings
It's like a  callin' my mind, baby
I'm overthinking, thinking should be over
I'm feeling insecure
I just can't seem to close the door, baby
But what I got is so fly
Why am I wasting all my time?
I know the  don't feel right
Lot of lows for just a few highs

But I woke up in the morning feeling like a bad bitch
 feeling damaged
I hate to see me settle for the average
I should tell 'em pack his bags and the bullshit, girl

Toxic love is just bad habit (tell him)
Waking up ain't lonely for a (bad bitch)
Toxic love is just bad habit (tell him)
If it ain't workin', don't work it, baby

You know you a bad bitch
Yeah, you know you a bad bitch
Yeah, you know you a bad bitch
Yeah, you know you a bad bitch
Yeah, you know you a bad bitch
Yeah, you know you a bad bitch
Yeah, you know you a bad bitch
Yeah, you know you a bad bitch
Yeah, you know you a bad bitch
Yeah, you know you a bad bitch
Yeah, you know you a bad bitch
Yeah, you know you a bad bitch
Yeah, you know you a bad bitch
Yeah, you know you a bad bitch"
25,Dumpalltheguns,Adi Oasis,none
26,My Sunrise,Ruti,"Draw a line across the sky
Straight into a cloud and out the other side
I wanna take you far away
Far enough so you forget the mess you made
Somewhere that you can tell me
What's been on your mind lately
Maybe a place that we both know
Three days and nights you'll find out
Those things you worry about
There out of your control

And we got time
So lay back unwind
And stay up with me and my sunrise
You could try to release your mind
And stay up with me and my sunrise

Too much concrete in the way
I just wanna run free in that open space
Brush the dust right off your bones
Don't watch it settle let's get up and go

'Cause we got time
So lay back unwind
And stay up with me and my sunrise
Baby try to release your mind
And stay up with me and my sunrise

Silver and Gold
Please let me hold
You here with me
Don't turn away
Sit down and stay
And you will see

We got time
So lay back unwind
And stay up with me and my sunrise
You could try to release your mind
And stay up with me and my sunrise
Stay up with me and my sunrise
Stay up with me and my sunrise"
27,Fragile Eyes,Raquel Martins,none
28,Gold Chains,Rosa Cecilia,none
29,Calling My Name,Freya Roy,none
30,Man On The Moon,R.E.M.,"Mott the Hoople and the Game of Life
Yeah, yeah, yeah, yeah
Andy Kaufman in the wrestling match
Yeah, yeah, yeah, yeah
Monopoly, Twenty-One, checkers and chess
Yeah, yeah, yeah, yeah
Mister Fred Blassie in a breakfast mess
Yeah, yeah, yeah, yeah
Let's play Twister, let's play Risk
Yeah, yeah, yeah, yeah
See you in heaven if you make the list
Yeah, yeah, yeah, yeah

Now, Andy, did you hear about this one?
Tell me, are you locked in the punch?
Andy, are you goofing on Elvis? Hey, baby
Are we losing touch?

If you believed they put a man on the moon
Man on the moon
If you believed there's nothing up his sleeve
Then nothing is cool

Moses went walking with the staff of wood
Yeah, yeah, yeah, yeah
Newton got beaned by the apple good
Yeah, yeah, yeah, yeah
Egypt was troubled by the horrible asp
Yeah, yeah, yeah, yeah
Mister Charles Darwin had the gall to ask
Yeah, yeah, yeah, yeah

Now, Andy, did you hear about this one?
Tell me, are you locked in the punch?
Hey, Andy, are you goofing on Elvis? Hey, baby
Are you having fun?

If you believed they put a man on the moon
Man on the moon
If you believed there's nothing up his sleeve
Then nothing is cool

Here's a little agit for the never-believer
Yeah, yeah, yeah, yeah
Here's a little ghost for the offering
Yeah, yeah, yeah, yeah
Here's a truck stop instead of Saint Peter's
Yeah, yeah, yeah, yeah
Mister Andy Kaufman's gone wrestling (wrestling bears)
Yeah, yeah, yeah, yeah

Now, Andy, did you hear about this one?
Tell me, are you locked in the punch?
Hey, Andy, are you goofing on Elvis? Hey, baby
Are we losing touch?

If you believed they put a man on the moon
Man on the moon
If you believed there's nothing up his sleeve
Then nothing is cool

If you believed they put a man on the moon
Man on the moon
If you believed there's nothing up his sleeve
Then nothing is cool
If you believed they put a man on the moon
Man on the moon
If you believed there's nothing up his sleeve
Then nothing is cool
If you believed they put a man on the moon
Man on the moon
If you believed there's nothing up his sleeve
Then nothing is cool"
31,Sabré Olvidar,Silvana Estrada,"Sabré olvidar
Porque el silencio no da opción cuando uno canta
Y este dolor se ha de esfumar en mi garganta
Sabré olvidar

Sabré olvidar
Aunque ahora cargue la desgracia entre mis dientes
Pues, sonreír es un remedio de valientes
Sabré olvidar

Y que te cante quien te quiera de verdad
Y que te llore aquel que no te sepa amar
Y que te robe el corazón sin avisar
Para que entiendas de milagros y del mar
Voy a callar un par de días
Alejarme de tu nombre
Abandonar mi artillería
Abrazarme al horizonte y a olvidar, sabré olvidar
Uh-uh-uh-uh-uh
Uh-uh-uh-uh-uh, uh-uh
Uh-uh-uh, uh-uh-uh-uh-uh, uh
Ah y ah, ay-ah

Sabré bailar
Sabré tomar entre mis manos la alegría
Y devolverla, poro a poro, hasta mi vida
Sabré olvidar

Sabré gritar
Pintar colores en el techo con mi boca
Dejar de lado tu promesa que me estorba
Sabré olvidar

Y que te cante quien te quiera de verdad
Y que te llore aquel que no te sepa amar
Y que te robe el corazón sin avisar
Para que entiendas de milagros y del mar
Voy a callar un par de días
Alejarme de tu nombre
Abandonar mi artillería
Abrazarme al horizonte y a olvidar, sabré olvidar
Uh-uh-uh-uh-uh
Uh-uh-uh-uh-uh, uh-uh
Uh-uh-uh, uh-uh-uh-uh-uh, uh
Ah y ah, ay-ah

Y que te cante quien te quiera de verdad
Y que te llore aquel que no te sepa amar
Y que te robe el corazón sin avisar
Para que entiendas de milagros y del mar
Voy a callar un par de días
Alejarme de tu nombre
Abandonar mi artillería
Abrazarme al horizonte y a olvidar, sabré olvidar"
32,La Enfermedad Del Siglo,Silvana Estrada,none
33,Girl Feels Good,FKA twigs,"I fear the man who finds himself lost
In tales of war, delusions of more
Beautiful boys, I wish you knew how precious you are
Your mother's, sister's, lover's heart is where there's healing

When a girl feels good, it makes the world go 'round
When the night feels young, you know she feels pretty
A girl feels good, and the world goes 'round
Turn your love up loud to keep the devil down

When a girl feels good, you'll know
When a girl feels good, you'll know
When a girl feels good, she's gonna keep you around
When a girl feels good, you'll know (Ooh-ooh, ooh-ooh; Da-da-da)

My city guy
Your boots on the gas of life
Hurry up, baby, take your time
Don't wanna force it, want you to touch it
My sweet demisе
A man that doesn't know his mind
It's okay, baby, take your time
Wе're gonna make it, wanna enjoy it

When a girl feels good, it makes the world go 'round
When the night feels young, you know she feels pretty
A girl feels good, and the world goes 'round
Turn your love up loud to keep the devil down

When a girl feels good, you'll know
When a girl feels good, you'll know
When a girl feels good, the honeybees to the flowers
When a girl feels good, you'll know (Ooh-ooh, ooh-ooh)

(When a girl feels good, it makes the world go 'round)
(When the night feels young, you know she feels pretty)
(A girl feels good, and the world goes 'round)
(Turn your love up loud to keep the devil down)
(When a girl feels good, you'll know)
(When a girl feels good, you'll know)
(When a girl feels good, she's gonna keep you around)
(When a girl feels good, you'll know, ah-ah, ah-ah)
(Ah-ah, ah-ah, ah-ah, ah-ah)"
34,Boomerang,Yebba,"Oh!
Ooh-ooh-ooh!

If I shoot him in the stomach
Then he’s hurting on my dime
And if I shoot him in the head, then he’s dead and he’s livin’ on my mind
My reflection in the mirror
Her perfection in his eyes
I’m a danger to myself
I run from twelve
And take my rage across the county line, oh

But I won’t let this go
Not my tomorrow
Don’t forget your pride, it’s laying in her bed of sorrow

What you done to me
I swear to you it’s gonna come back like a boomerang
Wooooo
Wooooo
Woooooooooo

You knew my daddy didn’t like you
From the moment you two met
Hе knew too well, you would drag me through Hеll
And never come back for the baby we’d regret
Oh

But I won’t let this go
Not my tomorrow
Don’t forget your pride
It’s laying in her bed of sorrow

What you, what you done to me
I swear to you it’s gonna come back like a boomerang
Woooooo
Wooooo
Woooooooooo
What you done to me
I swear to you it’s gonna come back like a boomerang
And knock you to your knees
I swear to you it’s gonna come back like a boomerang
Woooooo
Woooo
Wooooo"
35,Underneath My Feet,Lady Wray,"I know you don't like me, I knew we would meet
It won't be long, this short little meet-and-greet
You're cold and empty between you and I
Knock me down? They say you would try

Go 'head, get down, yeah (Underneath my feet)
You know where to lie (Underneath my feet)
Go 'head, get down (Underneath my feet)
Oh yeah (Underneath my feet)

I'm a voodoo woman, put a spell on you
Better watch what you say now, better watch what you do
I got my eye on the devil in you
And it's showing me the damage you do
Now it's your turn to suffer and weep
I won't be satisfied 'til you're under my feet

Go 'head, get down, yeah (Underneath my feet)
Oh (Underneath my feet)
You know just where to lie, love (Underneath my feet)
You know where to lie (Underneath my feet)

Hey, oh yeah
Uh
Whoa
Underneath, underneath my feet, yeah

Whoo (Underneath my feet)
Whoo (Underneath my feet)
Whoo (Underneath my feet)
Whoo (Underneath my feet)
(Underneath my feet)
You know where to lie (Underneath my feet)
They said you would try (Underneath my feet)
You know where to lie (Underneath my feet)
You know where to lie"
36,Make Me Over,Lady Wray,"I spent all my money
I'm home looking bummy, yeah
Will you help me, honey?
I wanna go out with some friends
I need some ends
I’ve always been independent
But right now, I need you to do this for me

Just make me over
Make me over
Make me over

It's been fifty twenty, yeah
So glad you're still with me
I don’t want to be alone
No dollars in the bank
Hold my hand or I'll sink
When I get my paycheck
I promise to do something nice
But for now, oh

Just make me over
Make me over
Make me over

I need a little bit of spending money
I trust in you

Make me over (Make me over)
Make me over (Make me over)
Make me over
Yeah, yeah, yeah"
37,Do It Again,Lady Wray,"If you wanna pack your bags, go on ahead
Ain't no use in being friends if you can't hear what I'm saying to you
One of us needs to say it
Stop dragging it in the dirt now
One of us gonna get hurt now
So hard when you know it
The love has left the building
And we can't talk about it

We rolled the dice
And we lost in the end
Though our luck has run out, yeah
I would do it again

You know all the good and bad things that I've done, yeah
You're the best I've ever had
You pull me through
Baby, I rely on you
The two of us, the two of us need to say it
Stop dragging it in the dirt now
One of us gonna get hurt now
So hard when you know it
The love has left the building
And we can't talk about it

We rolled the dice
And we lost in the end
Though our luck has run out, yeah
I would do it again

Before I go, oh
Ooh, oh
Yeah, and again and again now
And again and again now

We rolled the dice, yeah
And we lost in the end
Though our luck has run out
I would do it again

Baby, I would do it again
Do it again
Oh, do it again
Oh, and again and again now
And again and again now
Ooh, do it again"
38,Mr. Carisma,Ximena Sariñana,"Va
¡Hey!

No, no me fio, no me fio ​de lo que dicen los demás de ti
Lo vivo en carne propia y si me gusta yo me quedo aquí
Hay dos maneras de mirar una moneda, y qué me importa a mí
Tus colores y bemoles no me asustan, yo te elijo a ti

Tú eres malo, malísimo, malo, el peor de la fila
Cuando me hablas así, al oído, así, hasta tu fama se me olvida
Eres malo, pero encantador, eres Mr. Carisma
Lo que otras tienen prohibido, pa' mí está servido, y que sе mueran de la envidia

(Mе hace daño)

No, no me fio, no me fio ​de lo que dicen los demás de ti
Lo vivo en carne propia y si me gusta yo me quedo aquí
Siempre hay un roto para un descosido, te lo firmo yo
Que de todo lo había, preferí el que no valía, y ya bailó

Tú eres malo, malísimo, malo, el peor de la fila
Cuando me hablas así, al oído, así, hasta tu fama se me olvida
Eres malo, pero encantador, eres Mr. Carisma
Lo que otras tienen prohibido, pa' mí está servido, y que se mueran de la envidia

Lo que otras tienen prohibido, pa' mí está servido, y que se mueran de la envidia


(Malo, malo, malísimo) Yo siempre caigo en la misma
(Malo, malo, malísimo) Me gana Mr. Carisma
(Malo, malo, malísimo) Malo, malo, malísimo, no hay nadie que se resista
(Malo, malo, malísimo) Malo, malo, malísimo, a su carisma, a su carisma

Tú eres malo, malísimo, malo, una causa perdida
Cuando me hablas así, al oído, así, hasta tu fama se me olvida
Tú eres malo, pero encantador, eres Mr. Carisma
Lo que otras tienen prohibido, pa' mí está servido, y que se mueran de la envidia

Lo que otras tienen prohibido, pa' mí está servido, y que se mueran de la envidia
Lo que otras tienen prohibido, pa' mí está servido, y que se mueran de la envidia"
39,Pretty Girls Walk,Big Boss Vette,"No matter what the fuck these hoes talkin' 'bout
Just know you a bad bitch
Every motherfuckin' time that you wake up
And you look in that motherfuckin' mirror

All the pretty girls walk like
This, this, this, this
This, pretty girls walk like
This, this, this, this
All the pretty girls walk like

Big Boss Vette (Yeah), pull up in a Vette (Skrrt)
Flooded out my wrist with some ice around my neck (Water)
Shittin' on my ex (Fuck him), on to the next (On God)
He know this pussy good 'cause he always come back (Ah)
I like diamonds, shinin', fly me to an island (Whew)
If I say I want it, then you know he gon' buy it (Money)
Foreign, private, designer, stylist (Ooh)
I'll throw a tantrum, now a bitch'll get childish (Wah-wah)
Go dumb on the dick, know he lovin' the moves (On God)
If I'm fuckin' with him, he ain't fuckin' with you (At all)
Made him blow a bag, spent it all on shoes (Yeah)

'Cause all the pretty girls walk like
This, this, this, this
This, pretty girls walk like
This, this, this, this
All the pretty girls walk like
This (Like), this (Like), this (Like), this (Like)
This (Like), pretty girls walk like
This (Like), this (Like), this (Like), this (Like)
All the pretty girls walk like—

Walk into this bitch like I got money then (I do)
I came in with some ballers, I ain't come with them (At all)
If I ain't got no section, I ain't comin' in (The fuck?)
Bottles after bottles, tell 'em spin it then (Where the bottles at?)
I got hittas on call, yeah, I go hard (Yeah)
Nails too long to be fightin' these broads (The fuck?)
Pussy stay clean (Ooh), a nigga gon' fiend (Come here)
A whole lotta power in these YSL jeans (Pussy)
If I let you hit it, better hit it from the back (Bend that thang over)
Wanna take me out, nigga, take me to the bank (Money)
Balenci's on my feet 'cause it's wetter than a sink (Yeah)

'Cause all the pretty girls walk like
This, this, this, this
This, pretty girls walk like
This, this, this, this
All the pretty girls walk like
This (Like), this (Like), this (Like), this (Like)
This (Like), pretty girls walk like
This (Like), this (Like), this (Like), this (Like)
All the pretty girls walk like—"
40,"Así Fue - En Vivo Desde Bellas Artes, México/ 2013",Juan Gabriel,"Perdona si te hago llorar
Perdona si te hago sufrir
Pero es que no esta en mis manos
Pero es que no esta en mis manos
Me he enamorado, me he enamorado
Me enamore
Perdona si te causo dolor
Perdona si te digo adios
Como decirle que te amo
Como decirle que te amo
Si me ha preguntado
Yo le dije que no
Yo le dije que no
Soy honesto con ella y contigo
A ella la quiero y a ti te he olvidado
Si tu quieres seremos amigos
Yo te ayudo a olvidar el pasado
No te aferres, ya no te aferres
A un imposible, ya no te hagas
Ni me hagas mas dao
Ya noooo
Tu bien sabes que no fue mi culpa
Tu te fuiste sin decirme nada
Y apesar que llore como nunca
Ya no seguias de mi enamorada
Luego te fuiste y que regresabas
No me dijiste y si mas nada
Por que? no se
Pero fue asi
Asi fue
Te brinde la mejor de las suertes
Yo me propuse no hablarte, no verte
Y hoy que has vuelto
Ya de eso no hay nada
Ya no debo, no puedo quererte
Ya no te amo!, me he enamorado
De un ser divino, de un buen amor
Que me enseo, a olvidar
Y a perdonar
Soy honesto con ella y contigo
A ella la quiero, a ti he olvidado
Pero si tu quieres seremos amigos
Yo te ayudo a olvidar el pasado
No te aferres, ya no te aferres
A un imposible, ya no te hagas
Ni me hagas mas dao
Ya nooo!!! no no no no no"
