,Song,Artist,lyrics
41,LA COMBI VERSACE,ROSALÍA,"Juntas por la noche
Puestas pa'l derroche
Tu pelo azabache
La combi Versace
Juntas por la noche
Puestas pa'l derroche
Tu pelo azabache
La combi Versace

¿Qué fue, qué fue, qué fue?
Vestida con colabo (Margiela colabo)
Medusa arriba y abajo (Carla Bruni, woah, woah)
Donatella frenzy (Kilos, kilos de tela)
Soltando los Benjis (Cheques, cheques)
OG party con la Fania (Jerry Masucci)
Jangueando con salseros (Tito, Willie)
Bendicen toda' mis canciones
Para que tú te enamores

Juntas por la nochе
Puestas pa'l derroche
Tu pеlo azabache
La combi Versace
Juntas por la noche
Puestas pa'l derroche
Tu pelo azabache
La combi Versace

(¿Cómo es que fue?)
ROSI season coming (Expensiva)
Uzi y Albinoni
FaceTime con Milano (Tim Cook)
Dios bendiga a Gianni (Flores para Gianni)
Más fría que tu baby mama
Nos fuimos 7:30
Llego a la MET en pony
Pa' que tú te enamores

Juntos por la noche
Puestas pa'l derroche
Tu pelo azabache
La combi Versace
Juntos por la noche
Puestos pa'l derroche
Tu pelo azabache
La combi Versace (Eh, Toki, Toki, Toki)

Estilazo Versace saliendo del callejón
Desfilamos Dior custom en el colmadón
Con la tanga Gucci en una cola de motor
Me llevo to' el mall monta'o en un camión
Combino el rojo con el rosa, vestidas de blanco
Me visto de novia pero no soy tu esposa
Las tennis Valentino, y bizcocho de Moschino
Gargantilla de zafiro con diamante azul marino
Y si hoy llevo la ropa fake, es porque soy la más real
Bitch, me creo Dapper Dan
Me doy un flow de paca, me veo original
Soy la marca más cara que tú no vas a poder capear

Juntas por la noche
Puestas pa'l derroche
Tu pelo azabache
La combi Versace
Juntas por la noche
Puestas pa'l derroche
Tu pelo azabache
La combi Versace
Paul Roman, Paul Roman, colale–
Paul Roman, mmm
Se me ve el culo en Versace
Fue-Fuera del bajo mundo, fuera
Cheque, che—
Fuera, fuera, fuera
Fuera, fuera, fuera
Cheque, che—
Se me ve el culo en Versace
Se me ve el culo en Versace
Cheque, che—"
42,Gypsy Woman (She's Homeless) (La Da Dee La Da Da) - Basement Boy Strip To The Bone Mix,Crystal Waters,"I'm tryna get revenge
You'll be all out of love in the end

Spent ten hours on this flight, man
Told the pilot ain't no flight plans
Can't believe whatever I'm seein'
And they know whenever I land
Yeah, yeah, yeah, yeah

Fuck the club up, fuck the club up (Bitch)
Fuck the club up, fuck the club up (Bitch)
Fuck the club up, fuck the club up
Fuck the club up, fuck the club up (Yeah)

The party never ends
In a motel layin' with my sins, yeah
I'm tryna get revenge
You'll be all out of love in the end

Bicentennial man, put the city on slam
She get trippy off Xans, lost twenty-one grams
And she did it on cam, wasn't no video dance
Make my own rules, I really don't pick, I just choose
I don't set picks, I just shoot
Chopped and get screwed
I told her it's B.Y.O.B., that mean buy your own boobs
Put it on God, He the one that put me on top
Can't be put in a box, gotta move on the opps
Devil got the move on the drop
Niggas tryna move on the Scott
And move that deep, tryna run down, shit's steep
Gotta act a fool with the squad
Next city, no sleep, back to the 7-1-3

Spent ten hours on this flight, man
Told the pilot ain't no flight plans
Can't believe whatever I'm seein'
And they know whenever I land
Yeah, yeah, yeah, yeah

Fuck the club up, fuck the club up (Bitch)
Fuck the club up, fuck the club up (Bitch)
Fuck the club up, fuck the club up
Fuck the club up, fuck the club up (Yeah)

Time to make the club go up
Make the club go up
Make the club go up"
43,WTSGD,CLAY,none
44,VOY A LLeVARTE PA PR,Bad Bunny,
45,What It Is (Block Boy) (with Kodak Black),Doechii,
46,Jealousy,RUBII,
47,Fuck Me Pumps,Amy Winehouse,
48,Whatever You Like,T.I.,
49,Power,Joy Crookes,
50,Wild Jasmine,Joy Crookes,
51,Feet Don't Fail Me Now,Joy Crookes,
52,Kingdom,Joy Crookes,
53,Nasty,Tinashe,
54,Boss Bitch,Doja Cat,
55,Poison,Joy Crookes,
56,19th Floor,Joy Crookes,
57,Yah / Element - Medley,Joy Crookes,
58,No Hands,Joy Crookes,
59,Hallelujah,Pentatonix,
60,YYZ,Rush,
61,The Load-Out - Remastered,Jackson Browne,
44,VOY A LLeVARTE PA PR,Bad Bunny,"Acho, PR es otra cosa
Yo la conocí en Miami, en Brickell
Ella sabe que aquí hay ticket
Quiere que yo se la aplique
Que pa' casa la trafique

Vo'a llevarte pa' PR, mami, pa' que vea' cómo es que se perrea
Tráete a tu amiga si te gusta la idea
Dile que esta noche vamo' a janguear
Que rico la vamo' a pasar
Aquí nadie se va a casar
Pero tú te va' a querer quedar (Ey, ey)

Aprovecha, quе estoy soltero (Ay), single
Míramе mal si quiere' que te singue
Te vo'a llevar pa' PR to' el finde
Despué' de mí va' a borrar Tinder
Y estoy suelto, mami, estoy suelto
Mírame ahora, perreando un experto
Estoy suelto, mami, estoy suelto, ey, ey, ey
Hoy la calle está prendía', hookah, pastilla molía'
Yo no pierdo tiempo, yo las cambio como ROSALÍA
La que me mira a los ojo' por cinco segundo' ya yo sé que es mía
¿Dónde están las mala'? Que son bienvenía'
'Toy puesto pa'l lío, dime si tú lía'
Tus amiga' y to' el corillo 'tán bien rica'
Pero ese culo tuyo, wow, sobresalía
Salimo' de la disco y estaba de día
Obviamente salí con la que quería, ey
Que viva la putería
Dale pa'trá', pa'trá', tan-tan, chulería, ey
Dime si te va' a montar, pa' la isla tengo el portal
Bien borracho' los tre', baby, a las do' me las vo'a llevar
Oh, oh, me quiere besar, ja, yo que la puse mal
Tírate fotitos ahora porque ahorita te vo'a despeinar
Yeah-eh-eh-eh-eh

Vo'a llevarte pa' PR, mami, pa' que vea' cómo es que se perrea
Tráete a tu amiga si te gusta la idea
Dile que esta noche vamo' a janguear
Que rico la vamo' a pasar
Aquí nadie se va a casar
Pero tú te va' a querer quedar, yeah

Yeah, sí, sí
Esto es PR, mami
Aquí nací yo y el reggaetón, pa' que sepa'
Ey, ey, ey
Voy cazando y muero perreando
Voy cazando y muero perreando
Voy cazando y muero perreando
Que bailen toa' las gata', nos fuimo' algarete
'Tás escuchando al que más le mete
Dale, mami, suéltate el grillete
Ponte en cuatro, que te vo'a dar fuete
Ponte en cuatro, que te vo'a dar fue—"
45,What It Is (Block Boy) (with Kodak Black),Doechii,none
46,Jealousy,RUBII,"Said I'm on my, I'm on my
Said I'm on my, I'm on my
Said I'm on my, I'm on my
Said I'm on my, I'm on–

S-s-said I scared off, 1, 2, 3, 4, 5 now
Said I don't like it when I'm on my shit, 'cause I'm just so much better than you
Pull up the fine print, love and all vibin'
'Til they see girl like better somehow
Doin' up my thing, good for the writin'
Who's gonna run when they hear my sound, now?
Who's gonna run when they hear my–
Who's gonna run when they hear my–
Don't want no guy to run off and cry, 'cause I played him some of my worst
Sounds like a lie, happened in real time
Hope he don't feel no worse or no hurt

Said I'm on my, I do like this
No, I didn't come to play
You could be on yours, but you keep on getting in my way
They say, ""Way way too good to me"", so that thеy never stay
I've been told diffеrences, but think that it's jealousy

I think that's jealousy, now
I think that is jealousy
I think that's jealousy, now
I think that is jealousy

T-tellin' me not your style
All ideas lame, wack, it's twisted
Sit a little, ah-ah, wait for a while
And it's like whole mindset is shifted
See you really runnin' up my style
Wrap it up nice, pass it on, it's gifted
I-I think it's vile
I think–, I think it's vile, now
'Cause they keep telling me, ""Enemies love you like friend to me""
Hate me, but they love my flow
All of the talkin', like why you so for it?
Your back to corner with nowhere to go
Some of my mistakes that I made on ways
If I share my yays, will you take my worst?
Love to the strays from back in the day
They come and they play in the game I wrote

Said I'm on my, I'm on my
Said I'm on my, I'm on my
Said I'm on my, I'm on my
Said I'm on my, I'm on my
Said I'm on my, I'm on my
Said I'm on my, I'm on my
Said I'm on my, I'm on my
Said I'm on my, I'm on my

S-s-said I'm on my, I do like this
No, I didn't come to play
You could be on yours, but you keep on getting in my way
They say, ""Way way too good to me"", so that they never stay
I've been told differences, but think that it's jealousy

I think that's jealousy, now
I think that is jealousy
I think that's jealousy, now
I think that is jealousy"
47,Fuck Me Pumps,Amy Winehouse,"Woo

When you walk in the bar
And you're dressed like a star
Rockin' your ""eff me"" pumps
And a man notice you with your Gucci bag crew
Can't tell who he's looking to
'Cause you all look the same, everyone knows your name
And that's your whole claim to fame
Never miss a night, 'cause your dream in life
Is to be a footballer’s wife

You don't like players
That's what you say
But you really wouldn't mind a millionaire
You don't like ballers
They don't do nothing for ya
But you'd love a rich man six-foot-two or taller

You're more than a fan lookin' for a man
But you end up with one-night stands
He could be your whole life if you got past one night
But that part never goes right
In the morning, you're vexed
He's on to the next
And you didn't even get no text
Don't be too upset if they call you a sket
'Cause like the news, every day, you get pressed

You don't like players
That's what you say
But you really wouldn't mind a millionaire
All them big ballers
Don't do nothing for ya
But you'd love a rich man six-foot-two or taller

You can't sit down right, 'cause your jeans are too tight
And you lucky it's ladies' night
With your big empty purse
Every week it gets worse
At least your breast cost more than hers
So you did Miami, 'cause you got there for free
But, somehow, you missed the plane
You did too much E
Met somebody and spent the night getting caned

Without girls like you, there'd be no fun
We'd go to the club and not see anyone
Without girls like you, there's no night life
All those men just go home to their wives
Don't be mad at me 'cause you're pushing thirty
And your old tricks no longer work
You should have known from the jump
That you always get dumped
So dust off your ""fuck me"" pumps"
48,Whatever You Like,T.I.,"Aye, Jim, you know the ol' sugar daddies?
They be trickin', they tell them girls
I said you could have whatever you like (If you like)
I said you could have whatever you like (If you like)
Yeah (Yeah)

Stacks on deck, Patron on ice
And we can pop bottles all night
And, baby, you could have whatever you like (If you like)
I said you could have whatever you like, yeah
Late night sex, so wet and so tight
I gas up the jet for you tonight
And, baby, you could go wherever you like (If you like)
I said you could go wherever you like, yeah (Yeah)

Anytime you want to pick up the telephone, you
Know it ain't nothin' to drop a couple stacks on you
Want it, you could get it, my dear
Five million dollar home, drop Bentleys, I swear, yeah

I want yo' body, need yo' body
Long as you got me you won't need nobody
You want it, I got it, go get it, I'll buy it
Tell them other broke nigga be quiet

Stacks on deck, Patron on ice
And we can pop bottles all night
And, baby, you could have whatever you like (If you like)
I said you could have whatever you like, yeah
Late night sex, so wet and so tight
I gas up the jet for you tonight
And, baby, you could go wherever you like (If you like)
I said you could go wherever you like, yeah (Yeah)

Shawty, you the hottest, love the way you drop it
Brain so good I swore you went to college
Hundred karat deposit, to vacations in the tropics
‘Cause e'rybody know it ain't trickin' if you got it
You need never ever gotta go to yo' wallet
Long as I got rubberband banks in my pocket
Five, six rides with rims and a body kit
You ain't gotta downgrade, you can get what I get
My chick could have what she want
And go in any store for any bag she want
And, no, she ain't never had a man like that
To buy you anything your heart desire like that, yeah

I want yo' body, need yo' body
Long as you got me you won't need nobody
You want it, I got it, go get it, I'll buy it
Tell them other broke nigga be quiet

Stacks on deck, Patron on ice
And we can pop bottles all night
And, baby, you could have whatever you like (If you like)
I said you could have whatever you like, yeah
Late night sex, so wet and so tight
I gas up the jet for you tonight
And, baby, you could go wherever you like (If you like)
I said you could go wherever you like, yeah (Yeah)

I'm talkin' big boy rides, and big boy ice
Let me put this big boy in yo' life
You just be so fresh, and look so nice
Let me put this big boy in yo' life; that's right

I want yo' body, need yo' body
Long as you got me you won't need nobody
You want it, I got it, go get it, I'll buy it
Tell them other broke nigga be quiet

Stacks on deck, Patron on ice
And we can pop bottles all night
And, baby, you could have whatever you like (If you like)
I said you could have whatever you like, yeah
Late night sex, so wet and so tight
I gas up the jet for you tonight
And, baby, you could go wherever you like (If you like)
I said you could go wherever you like, yeah (Yeah)"
49,Power,Joy Crookes,"I don't need your permission
I don't want that disease
Lurking through every finger
That you pointed at me
Don't you like it so sexy?
Wearing it like it's free?
Dropping half-priced opinions
But calling me ""coupon queen,"" hm

You got bitches, you got hoes
We the people, and we know
All we want is to be accepted
But you see? No, you don't
You got ideas, all the same
I'm your scapegoat, feed me blame
In the back of your mind
You know you wasted time
And you're crossing lines with your
Crossing lines with your

Power
Come and spend it on me
Power
What it means to be free
Here's the truth, one condition
Can't kill my ambition
Not about if you like how I sing
Can't take my power
You got nothin' on me

You're a man on a mission
But you seem to forget
You came here through a woman
Show some fucking respect, hm

We your bitches, we your hoes
We the people, and we know
All we want is to be accepted
But you see? No, you don't
You got ideas, all the same
I'm your scapegoat, feed me blame
In the back of your mind
You know you wasted time
And you're crossing lines with your
Crossing lines with your

Power
Come and spend it on me
Power
What it means to be free
Here's the truth, one condition
Can't kill my ambition
Not about if you like how I sing
Can't take my power
You got nothin' on me
On me, on me, on me, on me
On me, on me, on me, on me
On me, on me, on me, on me

Close your eyes 'til you can't see me
Yellow polka dot burkini
That they stole off her body that day
If you really want to free me
Tell my mummy that she's pretty
Melanin is not your enemy

Power
Come and spend it on me
Power
What it means to be free
Here's the truth, one condition
Can't kill my ambition
Not about if you like how I sing
Can't take my power
You got nothin' on me
On me, on me, on me, on me
On me, on me, on me, on me
On me, on me, on me, on me"
50,Wild Jasmine,Joy Crookes,"I'm not trusting no nighttime
Falling into arms with the wrong eyes
My guard high, so very high
Jesus doesn't have hotline
Who am I supposed to call but the dark side?
Trouble finds where I can hide

Why you do me, why you do me, why you do me like
Why you do me, why you do me, why you do me like that?
Wild Jasmine, don't trust him
Why you do me, why you do me, why you do me like
Why you do me, why you do me, why you do me like that?
Wild Jasmine, don't love him

Ten tonne heart everybody wanna steal
They want my song, but my pain don't gеt a deal
You know I know just how you feel
You know I know just how you feel
You want the skin but refusе to take the baggage
You want the words but refuse to do the damage
You know you don't know how I feel
You know you don't know how—

Why you do me, why you do me, why you do me like
Why you do me, why you do me, why you do me like that?
Wild Jasmine, don't trust him
Why you do me, why you do me, why you do me like
Why you do me, why you do me, why you do me like that?
Wild Jasmine, don't love him


Why you do me, why you do me, why you do me like
Why you do me, why you do me, why you do me like that?
Wild Jasmine, don't trust him
Why you do me, why you do me, why you do me like
Why you do me, why you do me, why you do me like that?
Wild Jasmine, don't love him

Ten tonne heart everybody wanna steal
They want my song, but my pain don't get a deal
You know I know just how you feel
You know I know just how you feel
You want the skin but refuse to take the baggage
You want the words but refuse to do the damage
You know you don't know how I feel
You know you don't know how—

Why you do me, why you do me, why you do me like
Why you do me, why you do me, why you do me like that?
Wild Jasmine, don't trust him (Why you do me like that?)
Why you do me, why you do me, why you do me like
Why you do me, why you do me, why you do me like that?
Wild Jasmine, don't love him (Why you do me like that?)

(Why you do me, why you do me, why you do me like)
(Why you do me, why you do me, why you do me like that?)"
51,Feet Don't Fail Me Now,Joy Crookes,"I've been posing with red skies
Retweeting picket signs
Put my name on petitions, but I won't change my mind
I'm keeping up appearances
The dark side of my privilege
Damn, thank God I've got my vice
The dopamine tuition will keep me wrong from right
But I don't like when my better side takes hold of me
I didn't want you to know

Man, I guess I was scared
Feet, don't fail me now
I got to stand my ground
And though I'm down for trying
I am better in denial
So I hush, don't make a sound
Feet, don't fail me now
I got to stand my ground
And though I'm down for trying
I am better in denial

I, I cry like crocodile
Then drink opinions out
I've always got an answer, thе sun shines out my mouth
There ain't a rulе I'd wanna break (There ain't a rule I'd wanna break)
I'd rather kill than show my face

Man, I guess I was scared
Feet, don't fail me now
I got to stand my ground
And though I'm down for trying
I am better in denial
So I hush, don't make a sound
Feet, don't fail me now (Feet, don't fail me now)
I got to stand my ground (Gotta stand my ground)
And though I was down for trying

I was scared
But no blame's worth buying
Am I better hiding?
Why? Oh, why?
Didn't I try?

I was scared
Feet, don't fail me now
I got to stand my ground (Gotta stand my ground)
And though I'm down for trying
I am better in denial
So I hush, don't make a sound
Feet, don't fail me now
I got to stand my ground, my ground
And though I'm down for trying

My feet, don't fail me now"
52,Kingdom,Joy Crookes,"Rolling up to vote, I toke my Benson
England's blowing smoke, it needs attention
Could use a lick of paint, a change of colour
Before they send us back across the water
Think I got a neighbour that's been feeling blue
But they won't stand down no matter what you say or do

How'd you learn to love if you're not taught to?
How do you dream of freedoms on a curfew?
Paying the price to live in our skin
It's wearing me thin

Who's got love for the taking?
Who's got heart for the aching?
No such thing as a Kingdom
When tomorrow's done for the children
They chop it up and divide
So meet me at the borderline
Where the burning bridges have been taking toll
We row, we row, we row the boat
We row, we row, we row the boat

Gambling the heartbreak of a nation
Breaking up the euros at the station
Visiting a bank for bread and butter
Don't want to see no doctor when we suffer
Think I got a neighbour that's been feeling blue
But maybe that's a symptom
Fucking with a kingdom that never fought for you

Who's got love for the taking?
Who's got heart for the aching?
No such thing as a Kingdom
When tomorrow's done for the children
They chop it up and divide
So meet me at the borderline
Where the burning bridges have been taking toll
We row, we row, we row the boat
We row, we row, we row the boat
We row, we row, we row the boat

Who's got love for the taking?
Who's got heart for the aching?
No such thing as a Kingdom
When tomorrow's done for the children
They chop it up and divide
So meet me at the borderline
Where the burning bridges have been taking toll
We row, we row, we row the boat
We row, we row, we row the boat
We row, we row, we row the boat
We row, we row, we row"
53,Nasty,Tinashe,"'Cause it feels like Heaven when it hurts so bad
Baby, put it on me, I like it just like that, just like that

I've been a nasty girl, nasty
I've been a nasty girl, nasty
I've been a nasty girl, nasty
I've been a nasty, nasty, nasty

Is somebody gonna match my freak?
Is somebody gonna match my freak?
Is somebody gonna match my nasty?
I got stamina, they say I'm an athlete
Is somebody gonna match my freak? (Match my freak)
Need somebody with a good technique (Good technique)
Is somebody gonna match my nasty?
Pillow talking got my throat raspy

If you keep up with me, I'll keep on comin' back
If you do it too good, I'm gonna get attached
'Cause it feels like Heaven when it hurts so bad
Baby, put it on me, I like it just like that, just like that

I'vе been a nasty girl, nasty
I've been a nasty girl, nasty (Just like that)
I've been a nasty girl, nasty
I'vе been a nasty, nasty, nasty (I like it just like that)
I've been a nasty girl, nasty
I've been a nasty girl, nasty (Just like that)
I've been a nasty girl, nasty
I've been a nasty, nasty, nasty

Big time, pull up, make a scene
Party's lame, no vibe, we can leave
Shotgun, my thighs on the seat
I ain't got nothin' underneath (Ooh)
Looks like you're 'bout to spend the night (Match my, match my freak)
Looks like I'm 'bout to change your life (Match my, match my freak)
Wife type, he's staying for a week
So I might just let him pay the lease

If you keep up with me, I'll keep on comin' back (Oh-woah-woah)
If you do it too good, I'm gonna get attached (Oh-woah-woah)
'Cause it feels like Heaven when it hurts so bad
Baby, put it on me, I like it just like that (Like it), just like that

I've been a nasty girl, nasty
I've been a nasty girl, nasty (Just like that)
I've been a nasty girl, nasty
I've been a nasty, nasty, nasty (I like it just like that)
I've been a nasty girl, nasty
I've been a nasty girl, nasty (Just like that)
I've been a nasty girl, nasty (Oh)
I've been a nasty, nasty, nasty

If you keep up with me, I'll keep on comin' back
If you do it too good, I'm gonna get attached
'Cause it feels like Heaven when it hurts so bad
Baby, put it on me, I like it just like that (Like it just like that), just like that

(Oh, ah, oh, ah) Nasty, nasty, nasty
(Oh, ah, oh, ah) Nasty, nasty, nasty
(Oh, ah, oh, ah) Nasty, nasty, nasty
(Oh, ah, oh, ah) Nasty, nasty, nasty"
54,Boss Bitch,Doja Cat,"Mmm
I ain't tryna (Ah)
I ain't tryna
I ain't tryna

Yeah, ain't tryna be cool like you
Wobblin' around in your high heel shoes
I'm clumsy, made friends with the floor
Two for one, you know a bitch buy four
And two left feet, you know I always drop
First thing a girl did was a bop
I'm the whole damn cake and the cherry on top
Shook up the bottle, made a good girl pop

You ain't even here to party
Ken in the club, tryna pipe a Barbie
I don't wanna go, go, go with the flow
Backbend 'til I touch my toes
I don't wanna row, row, row the boat
Wrist full of rocks and I hope I float
Big up yourself 'cause you know they don't
I chew, chew, chew 'cause they hope I choke

I'm a bitch, I'm a boss
I'm a bitch and a boss, I'ma shine like gloss
I'm a bitch, I'm a boss
I'm a bitch and a boss, I'ma shine like gloss
I'm a bitch, I'm a boss
I'm a bitch and a boss, I'ma shine like gloss
I'm a bitch, I'm a boss
I'm a bitch and a boss, I'ma shine like gloss

Said bitch, I'm the after, you been the before
I been the stallion, you been the seahorse
Don't need a report, don't need a press run
All of my bad pics been all my best ones
I wear the hat and I wear the pants
I am advanced, so I get advance
And I do my dance and cancel the plans
Said boo, don't be mad 'cause you had the chance

Drop, said I took it and I ran for it
I won it, then I stand on it
Money on the floor when we dance on it
Shine bright, let them put a tan on it
Said I took it and I ran for it
I won it, then I stand on it
Money on the floor when we dance on it
Shine bright, let them put a tan on it like

I'm a bitch, I'm a boss
I'm a bitch and a boss, I'ma shine like gloss
I'm a bitch, I'm a boss
I'm a bitch and a boss, I'ma shine like gloss
I'm a bitch, I'm a boss
I'm a bitch and a boss, I'ma shine like gloss
I'm a bitch, I'm a boss
I'm a bitch and a boss, I'ma shine like gloss

Rrrr, ah, ah, ah
I'm a bitch (I'm a bitch), I'm a boss (I'm a boss)
I'm a bitch (I'm a bitch), I'm a boss (I'm a boss)
I'm a bitch (I'm a bitch), I'm a boss (I'm a boss)
I'm a bitch and a boss, I'ma shine like gloss

I'm a bitch, I'm a boss
I'm a bitch and a boss, I'ma shine like gloss
I'm a bitch, I'm a boss
I'm a bitch and a boss, I'ma shine like gloss
I'm a bitch, I'm a boss
I'm a bitch and a boss, I'ma shine like gloss
I'm a bitch, I'm a boss
I'm a bitch and a boss, I'ma shine like gloss"
