,Song,Artist,lyrics
0,Ella Baila Sola,Eslabon Armado,"Compa, ¿qué le parece esa morra?
La que anda bailando sola me gusta pa' mí
Bella, ella sabe que está buena
Que todos andan mirándola cómo baila
Me acerco y le tiro todo un verbo
Tomamos tragos sin peros, solo tentación
Le dije: ""Voy a conquistar tu familia, que en unos días vas a ser mía""
Me dijo que estoy muy loco, pero le gusta
Que ningún vato como yo actúa

Y ahí te va, mija
Y pura Doble P, viejo
Así nomás, compa Pedro
Puro Eslabon Armado
Pa' las plebitas
¡Cha-chau!

No soy un vato que tiene varo
Pero hablando del corazón, te cumplo todo
Me agarró, pеgadito de su mano
Mi compa ni se la creyó, quе al pasar fui yo
Su cuerpo, juro por Dios, que era tan perfecta
Su cinturita como modelo
Sus ojos desde el principio me enamoraron
A ella le gusto y a mí me gusta"
1,These Words,Natasha Bedingfield,"My heart
These words are my own
(Uh, yeah, uh)

Threw some chords together
The combination: D-E-F
It's who I am, it's what I do (Yeah, uh)
And I was gonna lay it down for you
I try to focus my attention
But I feel so A-D-D
I need some help, some inspiration (But it's not coming easily)

(Whoa) Tryna find the magic
(Oh) Tryna write a classic (Whoa)
Don't you know, don't you know, don't you know? (Whoa, whoa)
Wastebin full of paper (Whoa)
Clever rhymes, see ya later

These words are my own
From my heart flow (Yeah, uh)
I love you, I love you, I love you, I love you
There's no other way
To better say
I love you, I love you, I love you (Ah)

Read some Byron, Shelley, and Keats
Recited it over a hip-hop beat
I'm having trouble saying what I mean (Uh)
With dead poets and drum machines
You know I had some studio time booked
But I couldn't find the killa hook
Now you've gone and raised the bar right up
Nothing I write is ever good enough

These words are my own (These words are my own)
From my heart flow (From my heart flow)
I love you, I love you, I love you, I love you
There's no other way (There's no other way)
To better say (Uh)
I love you, I love you, I love you (I love you, I love you)
These words are my own (These words are my own)
From my heart flow (Yeah)
(I love you) I love you, I love you, I love you, I love you (I love you)
There's no other way (There's no other way)
To better say
I love you, I love you, I love you

I'm gettin' off my stage
The curtains pull away
No hyperbole to hide behind
My naked soul exposes (Love you, love you)
Whoa, oh
Whoa, whoa

(Whoa) Tryna find the magic
(Whoa) Tryna write a classic (Uh, yeah)
Wastebin full of paper
Clever rhymes, see you later

These words are my own (These words are my own)
From my heart flow (Don't you know?)
I love you, I love you, I love you, I love you
There's no other way (There's no other way, to better say)
To better say (Yeah, uh, yeah)
I love you, I love you, I love you
These words are my own (These words are my own)
From my heart flow (They are from my heart, yeah)
I love you, I love you, I love you, I love you (I love you)
There's no other way (There's no better way)
To better say (Yeah, uh, yeah)
I love you, I love you, I love you

These words are my own
They're from my heart (My heart)
(Yeah, uh) I love you, I love you
That's all I got to say
Can't think of a better way
And that's all I've got to say (Yeah, uh, yeah)
I love you, is that okay?"
2,"Guantanamera (feat. Ms. Lauryn Hill, Celia Cruz & Jeni Fujita)",Wyclef Jean,none
3,Vanish Into You,Lady Gaga,"Saw your face and mine
In a picture by our bedside
It was cold in the summertime

High on a hill, you call
Two lovers regret their time
Once in a blue moon, I forget you
And once in your life, you'll be mine

Do you see me? Do you see me now?
I've been waiting for you, cryin' out
Do you see me? Do you see me now?

Saw your face and mine
In a picture by our bedside
It was cold in the summertime
We were happy just to be alive
Can I vanish into you?
Can I vanish into you? (Yah)

Into the night, we fly
Sirens blow by our heads (Yah)

Do you see me? Do you see me now?
I've been waiting for you, cryin' out
Do you see me? Do you see me now?

Saw your face and mine
In a picture by our bedside
It was cold in the summertime
We were happy just to be alive
Can I vanish into you?
Can I vanish into you?

(Yah)

Saw your face and mine
In a picture by, by, by, by my bedside
It was cold in the summertime
We were happy just to be alive
Can I, I vanish into you?
Can I vanish into you? (Can I? Can I?)
Like a ghost, I, oh, oh-oh-oh-oh, vanish into you
Can I vanish into you?

When I die, can I vanish into you?"
4,Volver,Carmen Ferre,none
5,She's A Lady,Tom Jones,"Well, she's all you'd ever want
She's the kind I'd like to flaunt and take to dinner
Well, she always knows her place
She's got style, she's got grace, she's a winner

She's a lady
Whoa, whoa, whoa, she's a lady
Talkin' about that little lady
And the lady is mine

Well, she's never in the way
Always something nice to say, oh, what a blessing
I can leave her on her own
Knowing she's okay alone, and there's no messing

She's a lady
Whoa, whoa, whoa, she's a lady
Talkin' about that little lady
And the lady is mine

Well, she never asks for very much, and I don't refuse her
Always treat her with respect, I never would abuse her
What she's got is hard to find, and I don't want to lose her
Help me build a mountain from my little pile of clay
Hey, hey, hey

Well, she knows what I'm about
She can take what I dish out, and that's not easy
Well, she knows me through and through
And she knows just what to do, and how to please me

She's a lady
Oh, whoa, whoa, she's a lady
Talkin' about that little lady
And the lady is mine

Yeah, yeah, she's a lady
Oh, whoa, whoa, she's a lady
Listen to me people, she's a lady
Yeah, yeah, yeah-yeah, she's a lady
Whoa, whoa, whoa, she's a lady
Talkin' about the little Lady
Whoa, whoa, whoa, whoa, whoa
Whoa, whoa, whoa, whoa, whoa, whoa, she's a lady
Yeah, yeah, yeah, she's a lady
Whoa, whoa, whoa, she's a lady
I can't live without that little lady
Ooh-ooh, ooh, she's a lady"
6,Anxiety,Doechii,"Anxiety, keep on tryin' me
I feel it quietly
Tryin' to silence me, yeah
My anxiety, can't shake it off of me
Somebody's watchin' me
And my anxiety, yeah
Oh, oh, oh, oh, oh, oh

Solo, no mojo
I bounce back, no pogo
Unhappy, no homo
New brands, no logos
Money on my jugular, natural hustler
Think I need a smuggler up in Russia
You could be my butler, shine my cutla'
Shout out to Oyenda, that's the guzzler
Okay, next thing, my life is a wet dream
I call it a sex scene, the back is a nice tease
I tried to escape, my life is a X-rate
I'm sorry, a sex tape, you only get one take

Quiet on the set, please
Rolling ""Anxiety""
In three, two, one

Anxiety, keep on tryin' me
I feel it quietly
Tryin' to silence me, yeah
Anxiety, shake it off of me
Somebody's watchin' me
It's my anxiety, yeah (Brrah)

Anxiety, anxiet—, oh, I feel it tryin' (Oh)
Keep it tryin', keep it tryin'
Oh, I feel the silence (Oh)
Keep it quiet, keep it tired, oh, somebody's touchin' me (Ooh, la-da, woah)
Anxiety, anxiet—, oh, I feel anxiet— (Oh, oh, oh, oh)
My anxiety, anxiet—, oh, I feel it tryin' (It's my anxiety, can't let it conquer me)
Keep it tryin', keep it tryin', oh, I feel the silence (It's my anxiety, gotta shake it off of me)
Keep it quiet, keep it quiet, oh, somebody's watchin' me (It's my anxiety, can't let it caution me)
Anxiety, anxiet—, oh, I feel anxiety (It's my anxiety, gotta keep it off of me)
Anxiety, anxiet—, oh, I feel it tryin'
Keep it tryin', keep it tryin'
Oh, I feel the silence
Keep it quiet, keep it quiet
Oh, somebody's watching me
Anxiety, anxiet—, oh, I feel anxiety

Court order from Florid-er
What's in that clear blue water?
No limits, no borders
What's in that new world order?
Marco (Marco), Polo (Polo)
Negro run from popo (Popo)
That blue light and that rojo (Rojo)

And it's like
I get this tightness in my chest
Like an elephant is standing on me
And I just let it take over
Anxiety keeps on trying me
Anxiety keeps on tryin' me, yeah

Anxiety, anxiet—, oh, I feel it tryin' (Ooh)
Keep it tryin', keep it tryin' (Oh)
Oh, I feel the silence
Keep it quiet, keep it quiet
Oh, somebody's watchin' me (Oh, it keeps on trying me)
Anxiety, anxiet—, oh, I feel anxiet— (It keeps on trying, t-trying, trying, oh)
My anxiety, it's my anxiety, can't shake it off of me (It's my anxiety)
It's my anxiety, gotta keep it off of me (Can't shake it off of me)
It's my anxiety, can't shake it off of me (Oh, somebody's watchin' me)
It's my anxiety, gotta keep it off of me (Brrah)

Can't shake it off of me, shake, shake it off of me
It's my anxiety, gotta keep it off of me
Can't shake it off of me, shake, shake it off of me
It's my anxiety, gotta shake it off of me
Me
Me"
7,Abusadora,Wilfrido Vargas,"Qué hiciste (abusadora)
Qué hiciste (abusadora)
Qué hiciste (abusadora)
Qué hiciste (abusadora)
Abusadora (abusadora)
Abusadora (abusadora)
Abusadora (abusadora)
Abusadora (abusadora)
Qué hiciste (abusadora)
Qué hiciste (abusadora)
Qué hiciste (abusadora)
Qué hiciste (abusadora)
Abusadora (abusadora)
Abusadora (abusadora)
Abusadora (abusadora)
Abusadora (abusadora)
La mujer que quise me dejó y se fue
La mujer que quise me dejó y se fue
Y ahora ella quisiera volver
Y ahora ella quisiera volver
Qué hiciste (abusadora)
Qué hiciste (abusadora)
Qué hiciste (abusadora)
Qué hiciste (abusadora)
Qué hiciste (abusadora)
Qué hiciste (abusadora)
Qué hiciste (abusadora)
Qué hiciste (abusadora)
Cuando te fuiste no te dio pena
Cuando te fuiste no te dio pena
Y ahora sufres esa condena
Y ahora sufres esa condena
Qué hiciste (abusadora)
Qué hiciste (abusadora)
Qué hiciste (abusadora)
Qué hiciste (abusadora)
Abusadora (abusadora)
Abusadora (abusadora)
Abusadora (abusadora)
Abusadora (abusadora)
Qué hiciste (abusadora)
Qué hiciste (abusadora)
Qué hiciste (abusadora)
Qué hiciste (abusadora)
Qué hiciste (abusadora)
Qué hiciste (abusadora)
Qué hiciste (abusadora)
Qué hiciste (abusadora)
La mujer que quise me dejó y se fue
La mujer que quise me dejó y se fue
Y ahora ella quisiera volver
Y ahora ella quisiera volver
Qué hiciste (abusadora)
Qué hiciste (abusadora)
Qué hiciste (abusadora)
Qué hiciste (abusadora)
Qué hiciste (abusadora)
Qué hiciste (abusadora)
Qué hiciste (abusadora)
Qué hiciste (abusadora)
Cuando te fuiste no te dio pena
Cuando te fuiste no te dio pena
Y ahora sufres esa condena
Y ahora sufres esa condena
Qué hiciste (abusadora)
Qué hiciste (abusadora)
Qué hiciste (abusadora)
Qué hiciste (abusadora)
Abusadora (abusadora)
Abusadora (abusadora)
Abusadora (abusadora)
Abusadora (abusadora)
Qué hiciste (abusadora)
Qué hiciste (abusadora)
Qué hiciste (abusadora)
Qué hiciste (abusadora)
Abusadora (abusadora)
Abusadora (abusadora)
Abusadora (abusadora)
Abusadora (abusadora)
Ahora sí, te mata la pena
Ahora sí, te mata la pena
Mientras yo gozo a una mujer buena
Mientras yo gozo a una mujer buena
Qué hiciste (abusadora)
Qué hiciste (abusadora)
Qué hiciste (abusadora)
Qué hiciste (abusadora)
Abusadora (abusadora)
Abusadora (abusadora)
Abusadora (abusadora)
Abusadora (abusadora)
Cuando me dejaste tú no me querías
Cuando me dejaste tú no me querías
Vivía sufriendo de noche y de día
Yo vivía sufriendo de noche y de día
Qué hiciste (abusadora)
Qué hiciste (abusadora)
Qué hiciste (abusadora)
Qué hiciste (abusadora)
Abusadora (abusadora)
Abusadora (abusadora)
Abusadora (abusadora)
Abusadora (abusadora)
Abusadora
Qué hiciste (abusadora)
Qué hiciste (abusadora)
Qué hiciste (abusadora)
Qué hiciste (abusadora)
Abusadora (abusadora)
Abusadora (abusadora)
Abusadora (abusadora)
Abusadora (abusadora)
Ahora quieres que vuelva contigo
Ahora quieres que vuelva contigo
Pero es que yo no quiero ser tu amigo
Pero es que yo no quiero ser tu amigo
Qué hiciste (abusadora)
Qué hiciste (abusadora)
Qué hiciste (abusadora)
Qué hiciste (abusadora)
Abusadora (abusadora)
Abusadora (abusadora)
Abusadora (abusadora)
Abusadora (abusadora)
Abusadora"
8,O Pato,TRÍADA,none
9,Una Vida Buena,Kany García,"Me desperté cansada
Cansada de vivir en una vida que no me da nada
Tan triste, aburrida, deprimida, pero con más ganas
De hacer una maleta y mandar todo pa' la chingada

Y bailar
Hasta que me duelan los talone'
Volverme una rompecorazones
Y que to's se enamoren de mí

Yo quiero vivir una vida buena
Un traguito 'e ron de almuerzo y de cena
Si me lleva el diablo, que valga la pena
Así voy a vivir y así quiero morir
Ya no tengo marido, tengo una vida buena
Tеngo un par de jevo' y una que otra jеva
Y si me quedo pobre, pobre pero buena
Yo me quiero tanto

Quiero comprar lo que quiera sin mirar la cuenta
A mí ya nadie me espera y menos me gobierna
Ciao, que ya no te quiero aquí, al la'o
Te me saliste del corazón
Al fin no eras tan bueno
Tú era' como una mala canción
Que ya ni me la recuerdo

Y bailar
Y hacer to' lo que a mí se me antoje
Volverme una rompecorazones
Y que to's se enamoren de mí

Yo quiero vivir una vida buena
Un traguito 'e ron de almuerzo y de cena
Si me lleva el diablo, que valga la pena
Así voy a vivir y así quiero morir
Ya no tengo marido, tengo una vida buena
Tengo un par de jevo' y una que otra jeva
Y si me quedo pobre, pobre pero buena
Yo me quiero tanto
Y ya no tengo marido, tengo una vida buena
Tengo un par de jevo' y una que otra jeva
Y si me quedo pobre, pobre pero buena
Yo me quiero tanto

Ay, toda para mí"
10,La Malquerida,Kany García,"Yo solo quería la verdad y tú con tus mentiras
Me abriste los ojos, también las heridas
Y aunque te tenía de primera en mi plan de vida
Dejándolo todo por tu compañía

¿Pa' que voy a suplicarte y a querer volver?
Si así de lejitos nos llevamos bien
Y en cualquier momento la vuelves a hacer

Ay, qué dolor
Cuanto me han herido
Yo que lo di todo, y cuanto me han jodido
Por eso sé que tú hoy juegas con mi mente
Por eso sé que tú no eras diferente
Ay, yo tengo carita de inocente
Pero tengo espuelas, tengo afilado los dientes

Ya me contaron que te vieron con alguien
Y aunque quise matarte, que te vaya bien
A mí me gusta respirar buenos aires
Y si vuelvo a buscarte, sería perder

¿Pa' que voy a suplicarte y a querer volver?
Si así de lejitos nos llevamos bien
Y en cualquier momento la vuelves a hacer

Ay, qué dolor
Cuanto me han herido
Yo que lo di todo, y cuanto me han jodido
Por eso sé que tú hoy juegas con mi mente
Por eso sé que tú no eras diferente
Ay, yo tengo carita de inocente
Pero tengo espuelas, tengo afilado los dientes

Me dicen la malquerida, pero bueno
Me dejaste alguna herida, y eso es bueno
Me emborracho todos los días, ay, qué bueno
Y celebro tu partida de nuevo
Me dicen la malquerida, pero bueno
Me dejaste alguna herida, y eso es bueno
Me emborracho todos los días, ay, qué bueno
Y celebro tu partida de nuevo

Ay, qué dolor
Cuanto me han herido
Yo que lo di todo, y cuanto me han jodido
Por eso sé que tú hoy juegas con mi mente
Por eso sé que tú no eras diferente
Ay, yo tengo carita de inocente
Pero tengo espuelas, tengo afilado los dientes

Me dicen la malquerida, pero bueno
Me dejaste alguna herida, y eso es bueno
Me emborracho todos los días, ay, qué bueno
Y celebro tu partida de nuevo (La malquerida)
Me dicen la malquerida, pero bueno
Me dejaste alguna herida, y eso es bueno
Me emborracho todos los días, ay, qué bueno
Y celebro tu partida de nuevo"
11,Historia Repetida,Kany García,"Tú con esas ganas que tenías de salir corriendo
Y yo que ya me olía que esto estaba cerca del final
Lo que tanto construimos ya se lo ha llevado el viento
Justo lo que más le tuve miedo me ha vuelto a pasar-ar

Y ya me lo decía yo, que te volverías un mal necesario
Ya me lo advertía yo, que me dolería dormir en tus labios
Ya me repetía yo, y fui justamente haciendo lo contrario
Ni tú, ni yo, ni tú, ni yo

Somos los culpablеs de lo que ha pasado
Tú querías quеrerme y yo ya te quería
Yo que te tenía mal acostumbrado a que tus migajas me satisfacían
Tú buscando fuerzas pa' quererme, pero tan cerca de la salida
Esto lo ha vivido tanta gente, somos una historia repetida

Ya me lo decía yo, que te volverías un mal necesario
Ya me lo advertía yo, que me dolería dormir en tus labios
Ya me repetía yo, y fui justamente haciendo lo contrario
Ni tú, ni yo, ni tú, ni yo

Si ya me lo decía yo, que te volverías un mal necesario
Ya me lo advertía yo, que me dolería dormir en tus labios
Ya me repetía yo, y fui justamente haciendo lo contrario
Ni tú, ni yo, ni tú, ni yo

Ni tú, ni yo, ni tú, ni yo"
12,En Esta Boca,Kany García,"Ella, la que te enreda en sus pisadas
Con su sonrisa en primavera
Y sus ojos que la delataban
Yo me acerqué y me pegué porque sentía a la vez
Que su mirada me hablaba lo que no me decía
Ella esperó a que apaguen las luces, y yo quería encenderle la vida

En esta boca te volvías tan loca
Tu mirada de fuego me quitaba la ropa
Me decía' ""te quiero""
Ay, no te vaya' ahora, no
Si en esta boca te volvías tan loca
Se achicaban tus miedo', te olvidaba' de cosa'
Que nos llenan de frenos (De frenos)
Ay, no te vayas ahora (Yeah)

Te di de la que enchula y no me saca' de tu mente
Cuando somo' tú y yo en contra e' la corriente
Dice que no puede ni decir lo que siente
'Toy pa' robarte delincuente, ey, y lo malo es que te gusta
No sea' injusta, ojitos que delatan, no me asustan
Es a mí a la que busca', uff
Ojalá te me luzca', uff, sí
Si yo siento lo que siente', no te cohíba'
Si yo sé

Que en esta boca te volvía' tan loca
Tu mirada de fuego me quemaba la ropa
Me decías ""te quiero"" (Te quiero)
Ay, no te vaya' ahora (No te vaya' ahora)
Si en esta boca se volvía tan loca
Se achicaban sus miedo', se olvidaba de cosa'
Que nos llenan de frenos
Ay, no te vayas ahora, no

Yo no te espero, pero, déjate el cuento (Ah-ah-ah)
Te pasa' merodeando donde frecuento
Yo sé que tú tiene' un jevo, pero yo te lo hago má' bueno
Yo no te espero, pero, déjate el cuento
Te pasa' merodeando donde frecuento
Yo sé que tú tienes un jevo, pero conmigo va' de nuevo

Si en esta boca te volvía' tan loca
Tu mirada de fuego me quitaba la ropa
Me decía' ""te quiero"" (Te quiero)
Ay, no te vaya' ahora, no (No te vaya')
Si en esta boca te volvía' tan loca
Se achicaban tus miedo', te olvidaba' de cosa'
Que nos llenan de frenos
Ay, no te vayas ahora"
13,Amar y Partir,Zoe Gotusso,"A veces quiero que todo salga bien
Pero si pido más, me queda menos
Debo soltar la tensión que hay en mí
Alimentarme de tu amor sincero

Y para mi sería hermoso
Que tu fueras para mí
Y para ti sería un regalo
Que elegiste para abrir

Ayer te vi y te salía el sol
Si estoy con vos de nada tengo miedo
No piso el freno si me acompañas
Yo no me voy, pero yo no me quedo

Y para mi sería hermoso
Que tu fueras para mí
Y para ti sería un regalo
Que elegiste para abrir

Y sin embargo no me arrepentí
Porque hay algo que aprendí
Amar, partir, vivir así
Me voy pero siempre vuelvo

Y para mi sería hermoso
Que tu fueras para mí
Y para ti sería un regalo
Que elegiste para abrir
Y para mi sería hermoso
Que tu fueras para mí
Y para ti sería un regalo
Que elegiste para abrir"
14,Voy a Olvidarme de Mí (feat. Bomba Estéreo),Zoe Gotusso,"Que no es lo mismo verse en el espejo, que te siento lejos
Que muero por dentro y escucho en silencio
Que la lluvia dice que ya te perdí

Que no me importa si la casa es grande
Si me voy de viaje
Que el negocio es bueno
Si ese era mi sueño
Si el carro que tengo corre a más de mil

Que me arrepiento de ser aguafiestas
Todos estos años que viví contigo
Que me perdones si no me di cuenta
Que fui tu dueño y quiero ser tu amiga

Voy a peinarme y a tender la cama
Voy a ponerme mi mejor vestido
Voy a servir tu puesto allí en la mesa
Para sentir que vuelvo a estar contigo
Voy a pedirle al tiempo que no pase
Voy a encender la luz de mis promesas
Voy a sentarme al frente de la calle
Para esperar a ver si tú regresas

Que he sido un tonta por dejarte sola
Por buscar mil cosas
Por mi gran invento si al final del cuento
Yo ya nada tengo si no estás aquí

Que no me importa si la casa es grande
Si me voy de viaje
Que el negocio es bueno
Si ese era mi sueño
Si el carro que tengo corre a más de mil

Que me arrepiento de ser aguafiestas
Todos estos años que viví contigo
Que me perdones si no me di cuenta
Que fui tu dueño y quiero ser tu amiga

Voy a peinarme y a tender la cama
Voy a ponerme mi mejor vestido
Voy a servir tu puesto allí en la mesa
Para sentir que vuelvo a estar contigo
Voy a pedirle al tiempo que no pase
Voy a encender la luz de mis promesas
Voy a sentarme en frente de la calle
Para esperar a ver si tú regresas

Voy a olvidarme de mí
Yo puedo hacerte feliz
Nos quedaremos aquí
Voy a olvidarme de mí"
15,O My Heart,Mother Mother,"Oh my heart, it's a fish out of water
Oh my heart, it's a fish on the rocks and it bakes in the bad sun
Oh my heart, it's a rock in the gutter
Oh my heart, it's a rock and great boulder and stuck in the gutter

And I throw my heart back to the ocean
But it don't go far, it come back floating
And I watch it wash it up with the dead fish
But it ain't quite dead, it just is like this
Oh my heart, it's a house in tornado
Oh my heart, it's a house in the sky in the eye of tornado
Oh my heart, it's a roof in El Niño
Oh my heart, it's a roof made of straw in the jaw of El Niño

And I pour my heart a new foundation
But it don't set hard, it just stays shaking
And I scratch my name, I scratch my name in
But it don't set hard, it gets mixed back in

Bum bum bum, bum bum bum, bum bum bum, bum
Bum bum bum, bum bum bum, bum bum bum
Bum bum bum, bum bum bum, bum bum buhhh...

Oh my heart, it's a fish out of water
Oh my heart, it's a rock in the gutter
Oh my heart, it's the black in a rainbow
Oh my heart, it's so damn so cold, so damn cold

And I throw my heart into the fire
'Cause I want to set my heart on fire
And I watch it try, befriending embers
But the ice don't melt in mid-December

Oh my heart, it's a fish out of water
Oh my heart, it's a fish on the rocks and it bakes in the bad sun"
16,Ambidextrous,Rosa Cecilia,"Verse 1:
Do you know who you are?
Do you know the lives of brothers?
I am in the right mind
To snitch you to your mother
Do you empathise beyond the realms of yourself?
Do you try to challenge
Elements of convention
I doubt it
I doubt it
By the look of your Twitter page
You don’t think I have rights
You don’t think I should talk
You don’t believe a female
Should be pro-choice at all
You believe my friends
Of black and brown descent
Should bow and kiss the feet of holy colonialism and...
I doubt that
(we can be friends)… I doubt it
Chorus:
All these disparities
Left and right can’t find no unity
All these disparities
And I don’t want to be ambidextrous
All these disparities
Chia seeds and collard greens
All these disparities
And I don’t want to be ambidextrous

Verse 2:
Should I file a complaint
Who would even listen ? I’m a lying little temptress
Extremist feminism I would like to provide an extensive list of writers
From Morrison to Davis
Does that could entice ya?
I doubt it
I doubt it
Chorus:
All these disparities
Left and right can’t find no unity
All these disparities
And I don’t want to be ambidextrous
All these disparities
Chia seeds and collard greens
All these disparities
And I don’t want to be ambidextrous
Bridge:
Is it I against you?
Is it you against me?
Am I shutting out Potential harmony?
What do I have to lose?
There’s more than meets the eye
Conflict is cutting. Let’s unify...
Chorus:
All these disparities
Left and right can’t find no unity
All these disparities
And I don’t want to be ambidextrous
All these disparities
Chia seeds and collard greens
All these disparities
And I don’t want to be ambidextrous"
17,Faces,Crumb,"Words aren't easy, they'll come and they'll go
Feelings alive, but they'll never show
All of my heroes are people I know
Never see faces that look like my own

I wanna take it easy, retreat in my soul
I wanna feel your body when my hands are cold
Got me addicted to something you have
Let it grow inside me, it makes me so mad

It makes me so mad
It makes me so mad
It makes me so mad
It makes me so mad"
18,las consecuencias,Jaze,"Seré sincero, no estoy tranquilo
Ya abrí los ojos, no estoy dormido
Déjame solo que no es contigo, esto es conmigo y está metido
Allí en el fondo sigue escondido, yeah
No malentiendas mis intenciones
Sé que no entenderás las razones
Ya lo intenté con tantas canciones y explicaciones
No sé cómo hacer que esto funcione

Te lo digo por experiencia (Uh-uh-uh), no será suficiente la paciencia
Pa' quedarte al lado (Uh-uh-uh)
Y te lo digo como advertencia, pa' que no sufras las consecuencias
De estar al lado

Oh-oh, oh-oh, oh-oh
De estar al lado
Oh-oh, oh-oh

Ya sé que está desordenado el cuarto
Ya sé que me olvidé que era tu santo
Ya sé que me dijiste que no era para tanto
La pregunta es: ""¿Hasta cuándo?""
Y no sé qué hacer, quiero mantener el contacto
Tal vez si me das unos meses cambio
Porque de verdad quiero, sin embargo
Estoy atado y programado a decepcionarte una y otra vez
Ya ni siquiera sé si es por amor (Ya ni siquiera sé)
Que aún no te vas
No solamente esto lo pienso yo (Ya ni siquiera sé)
Me he quedado atrás, muy atrás

Te lo digo por experiencia, no será suficiente la paciencia
Pa' quedarte al lado, mm
Y te lo digo como advertencia, pa' que no sufras las consecuencias
De estar al lado
Te lo digo por experiencia (Uh-uh-uh), no será suficiente la paciencia
Pa' quedarte al lado (Uh-uh-uh)
Y te lo digo como advertencia, pa' que no sufras las consecuencias
De estar al lado

Oh-oh, oh-oh, oh-oh
De estar al lado
Oh-oh, oh-oh, oh-oh
De estar al lado
De estar al lado
De estar al lado
Oh-oh, oh-oh, oh-oh"
